<?xml version="1.0" encoding="UTF-8"?>
<!--CSS stylesheet is linked-->
<?xml-stylesheet type="text/css" href="catalog_19031649.css"?>
<!--Root element musicStore is created and external schema is linked-->
<musicStore xmlns:xs="http://www.w3.org/2001/XMLSchema-instance"
		xs:noNamespaceSchemaLocation="catalog_19031649.xsd">
		<!--storeDetails element storing details of the music store is created-->
		<storeDetails storeID="A015389KTM"><!--opening tag-->
			<logo></logo>
			<storeName>Pandora Records</storeName>
			<address>Kathmandu, Nepal</address>
			<phoneNum>9803456215</phoneNum>
			<website>www.pandorarecords.com</website>
		</storeDetails><!--closing tag-->
		<!--inventory element containing multiple album is created-->
		<inventory>
			<!--album element, containing albumTitle, albumArt and songs is created-->
			<album albumID="W34" category="Pop">
				<albumTitle>Whenever You Need Somebody</albumTitle>
				<albumArt></albumArt>
				<!--songs element containing multiple song is created-->
				<songs>
					<!--song element containing song details is created-->
					<song songID="W34T01" length="00:03:35">
						<songName>Never Gonna Give You Up</songName>
						<genre>Dance-pop</genre>
						<director>Simon West</director>
						<producers>
							<producer>Stock Aitken Waterman</producer>
						</producers>
						<writers>
							<writer>Mike Stock</writer>
							<writer>Matt Aitken</writer>
							<writer>Pete Waterman</writer>
						</writers>
						<singer>Rick Astley</singer>
						<releaseDate>
							<day>27</day>
							<month>July</month>
							<year>1987</year>
						</releaseDate>
						<label>RCA</label>
						<price>690</price>
					</song>
					<!--song element containing song details is created-->
					<song songID="W34T07" length="00:03:52">
						<songName>Slipping Away</songName>
						<genre>Pop</genre>
						<producers>
							<producer>Phil Harding</producer>
							<producer>Ian Curnow</producer>
						</producers>
						<writers>
							<writer>Rick Astley</writer>
						</writers>
						<singer>Rick Astley</singer>
						<releaseDate>
							<year>1987</year>
						</releaseDate>
						<label>RCA</label>
						<price>600</price>
					</song>
				</songs>
			</album>
			<!--album element, containing albumTitle, albumArt and songs is created-->
			<album albumID="P07" category="Comedy Hip Hop">
				<albumTitle>Pink Season</albumTitle>
				<albumArt></albumArt>
				<!--songs element containing multiple song is created-->
				<songs>
					<!--song element containing song details is created-->
					<song songID="P07T21" length="00:02:24">
						<songName>Dora the Explora</songName>
						<genre>Hip hop</genre>
						<producers>
							<producer>Pink Guy</producer>
						</producers>
						<writers>
							<writer>Pink Guy</writer>
						</writers>
						<singer>Pink Guy</singer>
						<releaseDate>
							<day>04</day>
							<month>January</month>
							<year>2017</year>
						</releaseDate>
						<price>420</price>
					</song>
					<!--song element containing song details is created-->
					<song songID="P07T29" length="00:03:10">
						<songName>Pink Life</songName>
						<genre>Hip hop</genre>
						<producers>
							<producer>Holder</producer>
						</producers>
						<writers>
							<writer>Pink Guy</writer>
						</writers>
						<singer>Pink Guy</singer>
						<releaseDate>
							<day>04</day>
							<month>January</month>
							<year>2017</year>
						</releaseDate>
						<price>420</price>
					</song>
				</songs>
			</album>
			<!--album element, containing albumTitle, albumArt and songs is created-->
			<album albumID="N18" category="Rhythem and Blues">
				<albumTitle>Nine Track Mind</albumTitle>
				<albumArt></albumArt>
				<!--songs element containing multiple song is created-->
				<songs>
					<!--song element containing song details is created-->
					<song songID="N18T13" length="00:03:49">
						<songName>See You Again</songName>
						<genre>Pop-rap</genre>
						<director>Marc Klasfeld</director>
						<producers>
							<producer>DJ Frank E</producer>
							<producer>Charlie Puth</producer>
							<producer>Andrew Cedar</producer>
						</producers>
						<writers>
							<writer>Charlie Puth</writer>
							<writer>Justin Franks</writer>
							<writer>Andrew Cedar</writer>
							<writer>Cameron Jibril Thomaz</writer>
						</writers>
						<singer>Wiz Khalifa</singer>
						<featuredArtist>Charlie Puth</featuredArtist>
						<releaseDate>
							<day>10</day>
							<month>March</month>
							<year>2015</year>
						</releaseDate>
						<label>Atlantic</label>
						<price>500</price>
					</song>
					<!--song element containing song details is created-->
					<song songID="N18T06" length="00:03:30">
						<songName>My Gospel</songName>
						<genre>Pop</genre>
						<producers>
							<producer>Charlie Puth</producer>
						</producers>
						<writers>
							<writer>Charlie Puth</writer>
							<writer>Josh Kear</writer>
						</writers>
						<singer>Charlie Puth</singer>
						<releaseDate>
							<day>29</day>
							<month>January</month>
							<year>2016</year>
						</releaseDate>
						<label>Atlantic</label>
						<price>480</price>
					</song>
				</songs>
			</album>
		</inventory>
</musicStore>